{
  "schema_version": "1.0",
  "artifact_type": "codebase_context",
  "artifact_id": "c554835a-7a9d-49da-80d2-51d889460478",
  "run_id": "b5dc622a-f92c-40e0-b4f0-315dec7b669b",
  "repo": "reformai-product",
  "commit_sha": "d768f3729d491236dda6dd87ceea84acf2c15485",
  "ref_requested": "main",
  "generated_at": "2026-06-03T17:12:09.105219+00:00",
  "feature_intent": "Add a catalogue of materials for suppliers and service providers",
  "generator": {
    "agent": "reformai.codebase-context-agent",
    "version": "1.0.0",
    "model": "claude-opus-4-5"
  },
  "inputs": {
    "target_key": "reformai-product",
    "ref_requested": "main",
    "feature_intent": "Add a catalogue of materials for suppliers and service providers",
    "concepts_to_check": [
      "Material",
      "Catalogue",
      "Supplier",
      "ServiceProvider",
      "Seller",
      "Market",
      "Project",
      "Subscription"
    ]
  },
  "entities": [
    {
      "id": "cbc:entity:user",
      "name": "users",
      "exists": true,
      "source": "table:users",
      "description": "Core user identity table with Firebase auth integration, account status, and subscription tracking",
      "fields": [
        {
          "name": "id",
          "semantic_hint": "identifier"
        },
        {
          "name": "firebaseId",
          "semantic_hint": "identifier"
        },
        {
          "name": "email",
          "semantic_hint": "email"
        },
        {
          "name": "accountStatus",
          "semantic_hint": "enum"
        },
        {
          "name": "subscriptionStatus",
          "semantic_hint": "enum"
        },
        {
          "name": "onboardingCompleted",
          "semantic_hint": "boolean"
        },
        {
          "name": "country",
          "semantic_hint": "text"
        },
        {
          "name": "preferredLanguage",
          "semantic_hint": "text"
        }
      ],
      "relationships": [
        {
          "to": "cbc:entity:service_provider",
          "kind": "one-to-one",
          "via": "serviceProviders.userId"
        },
        {
          "to": "cbc:entity:seller",
          "kind": "one-to-one",
          "via": "sellers.userId"
        },
        {
          "to": "cbc:entity:project",
          "kind": "one-to-many",
          "via": "projects.userId"
        }
      ],
      "confidence": "high",
      "evidence": [
        {
          "path": "apps/api/src/database/schema/users.ts",
          "lines": "1-80"
        }
      ]
    },
    {
      "id": "cbc:entity:role",
      "name": "roles",
      "exists": true,
      "source": "table:roles",
      "description": "System roles including admin, user, home_owner, home_buyer, service_provider, sellers",
      "fields": [
        {
          "name": "id",
          "semantic_hint": "identifier"
        },
        {
          "name": "roleName",
          "semantic_hint": "text"
        }
      ],
      "relationships": [],
      "confidence": "high",
      "evidence": [
        {
          "path": "apps/api/src/database/schema/roles.ts",
          "lines": "1-30"
        }
      ]
    },
    {
      "id": "cbc:entity:service_provider",
      "name": "serviceProviders",
      "exists": true,
      "source": "table:service_providers",
      "description": "Contractors/service providers with business profile, verification status, NIT (tax ID), and onboarding state",
      "fields": [
        {
          "name": "id",
          "semantic_hint": "identifier"
        },
        {
          "name": "userId",
          "semantic_hint": "foreign_key"
        },
        {
          "name": "businessName",
          "semantic_hint": "text"
        },
        {
          "name": "status",
          "semantic_hint": "enum"
        },
        {
          "name": "nit",
          "semantic_hint": "identifier"
        },
        {
          "name": "isVerified",
          "semantic_hint": "boolean"
        },
        {
          "name": "profileCompleted",
          "semantic_hint": "boolean"
        },
        {
          "name": "preferredClientType",
          "semantic_hint": "enum"
        },
        {
          "name": "yearsOfExperience",
          "semantic_hint": "enum"
        }
      ],
      "relationships": [
        {
          "to": "cbc:entity:user",
          "kind": "many-to-one",
          "via": "userId"
        }
      ],
      "confidence": "high",
      "evidence": [
        {
          "path": "apps/api/src/database/schema/serviceProviders.ts",
          "lines": "1-80"
        }
      ]
    },
    {
      "id": "cbc:entity:seller",
      "name": "sellers",
      "exists": true,
      "source": "table:sellers",
      "description": "Seller profile for real estate listings with onboarding workflow and agreement acceptance tracking",
      "fields": [
        {
          "name": "id",
          "semantic_hint": "identifier"
        },
        {
          "name": "userId",
          "semantic_hint": "foreign_key"
        },
        {
          "name": "businessName",
          "semantic_hint": "text"
        },
        {
          "name": "status",
          "semantic_hint": "enum"
        },
        {
          "name": "profileCompleted",
          "semantic_hint": "boolean"
        },
        {
          "name": "agreementAccepted",
          "semantic_hint": "boolean"
        },
        {
          "name": "onboardingStep",
          "semantic_hint": "quantity"
        }
      ],
      "relationships": [
        {
          "to": "cbc:entity:user",
          "kind": "many-to-one",
          "via": "userId"
        }
      ],
      "confidence": "high",
      "evidence": [
        {
          "path": "apps/api/src/database/schema/sellers.ts",
          "lines": "1-40"
        }
      ]
    },
    {
      "id": "cbc:entity:project",
      "name": "projects",
      "exists": true,
      "source": "table:projects",
      "description": "Renovation/construction projects owned by homeowners, supporting residential and commercial types",
      "fields": [
        {
          "name": "id",
          "semantic_hint": "identifier"
        },
        {
          "name": "userId",
          "semantic_hint": "foreign_key"
        },
        {
          "name": "name",
          "semantic_hint": "text"
        },
        {
          "name": "status",
          "semantic_hint": "enum"
        },
        {
          "name": "projectType",
          "semantic_hint": "enum"
        },
        {
          "name": "projectKind",
          "semantic_hint": "enum"
        },
        {
          "name": "budgetRange",
          "semantic_hint": "enum"
        },
        {
          "name": "budget",
          "semantic_hint": "money"
        },
        {
          "name": "isDraft",
          "semantic_hint": "boolean"
        },
        {
          "name": "isArchived",
          "semantic_hint": "boolean"
        }
      ],
      "relationships": [
        {
          "to": "cbc:entity:user",
          "kind": "many-to-one",
          "via": "userId"
        },
        {
          "to": "cbc:entity:project_room_material",
          "kind": "one-to-many"
        }
      ],
      "confidence": "high",
      "evidence": [
        {
          "path": "apps/api/src/database/schema/projects.ts",
          "lines": "1-200"
        }
      ]
    },
    {
      "id": "cbc:entity:project_room_material",
      "name": "projectRoomMaterials",
      "exists": true,
      "source": "table:project_room_materials",
      "description": "Material selections per room within a project - links to room material options catalog",
      "fields": [
        {
          "name": "id",
          "semantic_hint": "identifier"
        },
        {
          "name": "projectId",
          "semantic_hint": "foreign_key"
        },
        {
          "name": "renovationArea",
          "semantic_hint": "enum"
        },
        {
          "name": "commercialSpaceArea",
          "semantic_hint": "enum"
        },
        {
          "name": "materialCategory",
          "semantic_hint": "enum"
        },
        {
          "name": "material",
          "semantic_hint": "enum"
        },
        {
          "name": "optionName",
          "semantic_hint": "text"
        },
        {
          "name": "estimatedCost",
          "semantic_hint": "text"
        }
      ],
      "relationships": [
        {
          "to": "cbc:entity:project",
          "kind": "many-to-one",
          "via": "projectId"
        },
        {
          "to": "cbc:entity:room_material_option",
          "kind": "many-to-one",
          "via": "composite key"
        }
      ],
      "confidence": "high",
      "evidence": [
        {
          "path": "apps/api/src/database/schema/projects.ts",
          "lines": "350-380"
        }
      ]
    },
    {
      "id": "cbc:entity:room_material_option",
      "name": "roomMaterialOptions",
      "exists": true,
      "source": "table:room_material_options",
      "description": "Catalog of available material options per room type and category - populates frontend dropdowns",
      "fields": [
        {
          "name": "id",
          "semantic_hint": "identifier"
        },
        {
          "name": "renovationArea",
          "semantic_hint": "enum"
        },
        {
          "name": "commercialSpaceArea",
          "semantic_hint": "enum"
        },
        {
          "name": "materialCategory",
          "semantic_hint": "enum"
        },
        {
          "name": "material",
          "semantic_hint": "enum"
        },
        {
          "name": "optionName",
          "semantic_hint": "text"
        },
        {
          "name": "estimatedCostRange",
          "semantic_hint": "text"
        },
        {
          "name": "is_active",
          "semantic_hint": "boolean"
        },
        {
          "name": "order",
          "semantic_hint": "quantity"
        }
      ],
      "relationships": [
        {